word,definition
Lā-naʻi,"Island in Maui County, also known as Nā-naʻi, 13¼ miles long, 13 miles wide, with an area of 140 square miles and a 1970 population of 2,204; also elementary and high school. Lā-naʻi City (1,624 feet elevation) is the major town. Epithet: Lā-naʻi o Kaululāʻau (Lā-naʻi of Kaululāʻau). Perhaps lit., day [of] conquest."
Lanakila,"Elementary school, street, playground, and section 8 of Honolulu (map 6), Oʻahu.<br><br>Literally, victory (named in honor of Kamehameha's victory in the battle of Nuʻuanu).<br><br> Nā Lepili <br> Tags: Oʻahu <br> Papa helu loli"
Lani-pili,"Place, Wilhelmina Rise, Honolulu. Probably lit., clinging heaven. (Most streets on Wilhelmina Rise were named by non-Hawaiians. In Hawaiian, lanipili means 'cloudburst, heavy rain.')"
Lanipō,"Peak (2,621 feet high) back of Wilhelmina Rise and above Mauna-wili, Oʻahu. Lit., dense (as plant growth)."
Lapa-iki,"Gulch, northern Lā-naʻi. Lit., small ridge."
Lau-koa,"Place, Pacific Heights, Honolulu. (TM.) Lit., koa leaf."
Laulā,"Way, Kewalo section, Honolulu, Oʻahu.<br><br>Literally, wide.<br><br> Nā Lepili <br> Tags: Oʻahu <br> Papa helu loli"
Lau-niu,"Street, Wai-kīkī, Honolulu. (TM.) Lit., coconut leaf."
Lau-ʻulu,"Trail, Hale-a-ka-lā Crater, Maui. Lit., breadfruit leaf."
Lee,"Place, Nuʻu-anu, Honolulu, named for William L. Lee, Chief Justice of the Supreme Court of the Kingdom of Hawaiʻi under Ka-mehameha III and IV. He drew up a legal code, promulgated school laws, and served in the division of lands known as the Great Māhele. (TM.)"
Lehia,"Street, Foster Village subdivision, Hālawa, Waipahu qd., Oʻahu.<br><br>Literally, skilled.<br>Source:<br><br>Name suggested by Mary Kawena Pukui in 1958.<br><br><br><br> Nā Lepili <br> Tags: geography Oʻahu"
Lehua,"Island (291 acres, maximum elevation 710 feet) west of Niʻihau, the westernmost island of the main Hawaiian chain (not including the Northwestern Hawaiian Islands); landing, northeast Niʻihau. For a saying, see PE, kāʻili. Literally, lehua flower. (Pele's younger sister, Hiʻiaka, accompanying Pele on her first trip to Hawaiʻi, left a lehua lei at this island when her brother, Kāneʻāpua, decided to stay there.) <br>Elementary school, Pearl City, Oʻahu.<br><br>References:<br><br>PH 106; UL 258.<br><br><br><br> Nā Lepili <br> Tags: geography Niʻihau Oʻahu <br> Papa helu loli"
lei,‘garland’<br> Nā Lepili <br> Tags: lei <br> Papa helu loli
Lēkia,See Pōhaku-Hanalei.
Lele,"Land division near Hāʻupu, Kauaʻi, probably named for an event similar to that which resulted in the Oʻahu name Kohelepelepe.<br>Old name for the Lahaina district, Maui, so called because of the short stay of chiefs there (Pacific Commercial Advertiser, 1857).<br><br><br>Literally, altar or flight.<br>References:<br><br>See Maluʻulu-o-Lele.<br><br><br><br> Nā Lepili <br> Tags: Kauaʻi Maui <br> Papa helu loli"
Leleiwi,"No base definition, only supplemental content.<br>Cape, beach park, and point, Hilo qd., Hawaiʻi. A fish heiau (heiau hoʻoulu iʻa), named Pūhala (pandanus tree) once was near here. (For. Sel. 22, 24, 278; PH 189; UL 60.)<br>Heiau at Laʻaloa, Kona, Hawaiʻi.<br>Area, Hanalei district, Kauaʻi.<br>Pali and overlook, Haleakalā Crater, Maui.<br><br>Literally, bone altar (poetically, a symbol of disaster or anger).<br> Nā Lepili <br> Tags: Hawaiʻi Kauaʻi Maui <br> Papa helu loli"
Lenalena,"Land section and landing, Ka-laupapa peninsula, Molokaʻi. Lit., yellow."
Lepelepe,"Land section, Ka-malō qd., south Molokaʻi. Lit., fringed."
Liha,"Hill (3,671 feet high), Lahaina qd., Maui. Probably lit., to shudder."
Līhau,"Mountain (4,197 feet), Lahaina qd., Maui. Literally, gentle cool rain (considered lucky for fishermen; UL 241).<br> Nā Lepili <br> Tags: Maui <br> Papa helu loli"
Liholiho,"Dormitory, Ka-mehameha Schools, built in 1940; school, Ka-imu-kī; and street, Makiki, Honolulu, named for Ka-mehameha II, who was also called Ka-lani-nui-kua-liholiho-i-ke-kapu (the great chief [with the] burning-back taboo), referring to the taboo against approaching him from the back. Lit., glowing (see PE, liholiho)."
Likelike,"Highway and elementary school, Honolulu, Oʻahu, named for Princess Miriam Likelike (1851–1887), the younger sister of Kalākaua and Liliʻuokalani.<br> Nā Lepili <br> Tags: Oʻahu <br> Papa helu loli"
Likini,"Street and place, Moana-lua, Honolulu. (TM.) Lit., rigging."
Liliha,"Street along the western border of section 11 of Honolulu (map 6), named for the wife of Governor Boki of Oʻahu; after Boki's disappearance in 1829 she became governess of Oʻahu and in 1831 tried unsuccessfully to organize a revolt against Ka-mehameha III. Lit., rich, oily."
Līlīnoe,"Peak (12,956 feet), Mauna Kea qd., Hawaiʻi, also called Puʻu-Līlīnoe, named for a goddess of mists (Līlīnoe), sister of the more famous Poli-ahu, goddess of snow. Street, Wilhelmina Rise, Honolulu. Lit., mists."
Lima-huli,"Falls, stream, and valley near Ka-lalau, Kauaʻi. Lit., turned hand."
Limaloa,"Gulch, Nānākuli, Oʻahu. Limaloa is the name of a luckless lover in the Kamapuaʻa legend (For. Sel. 226, 230). Literally, long arm.<br> Nā Lepili <br> Tags: Oʻahu <br> Papa helu loli"
Līpeʻepeʻe,"Street, Waikīkī, Honolulu, Oʻahu, named for a seaweed.<br><br>References:<br><br>TM.<br><br><br><br> Nā Lepili <br> Tags: Oʻahu limu <br> Papa helu loli"
Lipioma,"Way, Mānoa, Honolulu. Lit., small adze."
Līpoa,"Point, Honolua qd., Maui, named for certain brown seaweeds.<br><br>References:<br><br>See Laelīpoa.<br><br><br><br> Nā Lepili <br> Tags: Maui limu <br> Papa helu loli"
Loʻaloʻa,"Heiau at Kau-pō, Maui, attributed to Ke-kau-like and re-dedicated by Liholiho when he was still a child. (RC 66, 188.) Lit., pitted."
Loʻi,"Street, upper Mānoa, Honolulu. Lit., patch (as of taro or rice)."
Lono,"Place, Mānoa, Honolulu, Oʻahu, named for the god Lono.<br> Nā Lepili <br> Tags: Oʻahu <br> Papa helu loli"
Lōpā,"Gulch and summer south-swell and trade-wind surfing area, east Lā-naʻi. Also called ʻĀwehi. Lit., tenant farmer."
Loulu,"Street, Mānoa, Honolulu, Oʻahu, named for the native fan palm.<br> Nā Lepili <br> Tags: Oʻahu <br> Papa helu loli"
lua,a type of hand-to-hand fighting
lua,"Pit, crater, hole'."
Lua-ʻehu,"Area at Lahaina, Maui, where an Episcopal school, known as Lua-ʻehu School, was established in 1862. The school was moved to Honolulu in 1871 and renamed ʻlo-lani. Lit., red-head pit (a red-haired moʻo lived here)."
Luakaha,"Street and land section, upper Nuʻu-anu, Honolulu, and the site of and name of the country home of Ka-mehameha III. Lit., place for relaxation."
Lua-wai,"Land section, Kai-lua qd., Hawaiʻi. Street and place, Ka-imu-kī, Honolulu. Lit., water hole."
Luhi,"Beach, north Kauaʻi.<br><br>Literally, tedious, tired.<br>Related:<br><br>The saying, Hoʻi i ke one o Luhi, go back to Tired Beach, refers to one returning to an unpleasant task; Appendix 8.1.<br><br><br><br> Nā Lepili <br> Tags: Kauaʻi <br> Papa helu loli"
Lukela,"Lane, Ka-lihi Waena, Honolulu, named for Joe Lukela, a fisherman. (TM.) Lit.,Luther."
Lumahaʻi,"Land division, canyon, stream, and beach, Hanalei district, Kauaʻi. Breadfruit trees here are said to have been planted by a Menehune named Weli (Rice 38)."
Mā,"Way, Wahi-a-wā, Oʻahu."
Māʻalaea,"Quadrangle, bay, village, and small boat harbor, Maui isthmus. Southeast of the boat harbor is a fringing reef, south-swell summer surfing area. Adjacent to the jetty is a surfing site known as Māʻalaea Rights. Road, ʻĀlewa, Honolulu. Perhaps a contraction of Maka-ʻalaea (ocherous earth beginning). (Ii 10.)"
Māʻalo,"Land section and gulch near Kaupō, Maui; a hau tree grove here was famed for illicit love affairs. Literally, pass by.<br> Nā Lepili <br> Tags: Maui <br> Papa helu loli"
Māeaea,"Beach and landing near Wai-a-lua, Oʻahu. (Ii 98.) Lit., stench."
Maʻemaʻe,"Elementary school and hill, Nuʻu-anu, Honolulu. Lit., clean (Elbert and Mahoe 33; UL 108.)"
Mahana,"Hill (1,800 feet high), Honolua qd., Maui.<br>Locality, Airport qd., Molokaʻi. The Molokaʻi Ranch, which in 1908 had 17,000 sheep, had a shearing shed here. The ranch stopped raising sheep in the 1920s.<br><br>* Pronunciation and meaning are uncertain.<br> Nā Lepili <br> Tags: Maui Molokaʻi <br> Papa helu loli"
Mahi,"Place, lower Mānoa, Honolulu, Oʻahu, named for a Hawaiian who owned much of the land.<br><br>Literally, strong.<br>References:<br><br>TM.<br><br><br><br> Nā Lepili <br> Tags: Oʻahu <br> Papa helu loli"
Mahiʻai,"Street and place, Ala Wai section, Honolulu, Oʻahu, named for the Chiefess Kealiʻimahiʻai, daughter of Nāhakuʻelua Pua of Mōʻiliʻili. Literally, farmer.<br><br>References:<br><br>TM.<br>See Nāhaku.<br><br><br><br> Nā Lepili <br> Tags: Oʻahu <br> Papa helu loli"
Māhie,"Point east of Kahana Bay, Oʻahu.<br>Street and place, Foster Village subdivision, Hālawa, Waipahu qd., Oʻahu.<br><br><br>Literally, delightful, charming, pleasant.<br>Source:<br><br>Name suggested by Mary Kawena Pukui in 1958.<br><br><br><br> Nā Lepili <br> Tags: Oʻahu <br> Papa helu loli"
Mahiki,"Land division, Wai-mea, Hawaiʻi, named for a horde of moʻo killed by Hiʻiaka. (PH chapter 12.) Lit., leap."
Māhinahina,"Land divisions, plantation, and point, Honolua qd., Maui.<br>A heiau of this name, now destroyed, was near the shore at Kaunakakai, Molokaʻi.<br><br><br>Literally, silvery haze (as of moonlight).<br><br> Nā Lepili <br> Tags: Maui Molokaʻi <br> Papa helu loli"
Mahuka,"Bay, Pāhala qd., Kaʻū, Hawaiʻi. Lit., flee."
Māʻihi,"Land division, Kai-lua qd., Hawaiʻi, named for Maʻihi-ʻala-kapu-a-Lono (fragrant sacred Māʻihi, [child] of Lono), a wind goddess."
"maika, ulu maika",old Hawaiian game similar to bowling
Maile,"Land section, Schofield qd., Oʻahu, probably named for the maile vine.<br> Nā Lepili <br> Tags: Oʻahu <br> Papa helu loli"
Māʻili,"Town, beach park, surfing area, playground, point, stream, and elementary school, Wai-ʻanae qd.; hill (1,510 feet high), Schofield qd., Oʻahu. Lit., pebbly."
Māʻiliʻili,"Hill and stream, Lualualei, Oʻahu. Also called Puʻu-Māʻiliʻili. Lit., pebbly."
Māilo,"Peak, Waimānalo, Oʻahu, said to be named for a strong chief.<br><br>Literally, thin.<br>References:<br><br>Sterling and Summers 5:338<br><br><br><br> Nā Lepili <br> Tags: Oʻahu aliʻi <br> Papa helu loli"
Maʻino,"Land section, Hāna, Maui. Lit., defacement. (A nearby cliff was called Pali-pilo [stinking cliff] because of deposits there of human excrement.)"
maka,"Point, eye'.<br> Papa helu loli"
Makaʻala,"Street, Moana-lua, Honolulu. (TM.) Lit., alert."
Makaʻeleʻele,"Gulch, Hālawa qd., Molokaʻi. Literally, black eye or black point.<br> Nā Lepili <br> Tags: Molokaʻi <br> Papa helu loli"
Mākaha,"Point, ridge, and valley, Waimea district, Kauaʻi.<br>Dwelling place of the demigods Hina and Māui at Kahakuloa, West Maui (Jarrett 24).<br>Land section, village, valley, point, elementary school, playground, beach park, stream, hotel, and two golf courses (called Mākaha Valley East and Mākaha Valley West), Kaʻena and Schofield qds., Oʻahu; the area is famous today for surfing (annual international championships are held here) and as a resort; in ancient days, famous for robberies.<br><br><br>Literally, fierce.<br>References:<br><br>Ii 97.<br><br><br><br> Nā Lepili <br> Tags: Kauaʻi Maui Oʻahu <br> Papa helu loli"
Makaīwa,"No base definition, only supplemental content.<br>Bay, Puakō qd., Hawaiʻi.<br>Ancient surfing area (Finney and Houston 30), Wailua, Kauaʻi. Kaʻililauokekoa, Moikeha's granddaughter, rode the curving surf of Makaīwa (HM 538).<br>Land area, east Lānaʻi.<br>Bay and land divisions, Keʻanae qd.; beach near Lahaina, Maui.<br>Gulch, Barber's Point, Oʻahu; street, Kāhala, Honolulu.<br><br>Literally, mother-of-pearl eyes (as in an image).<br> Nā Lepili <br> Tags: Hawaiʻi Kauaʻi Lānaʻi Maui Oʻahu <br> Papa helu loli"
Makalapua,"Place, downtown Honolulu, Oʻahu, perhaps named for the song of this name (Elbert and Mahoe 75-76) honoring Queen Liliʻuokalani. Literally, profuse bloom.<br><br>References:<br><br>TM.<br><br><br><br> Nā Lepili <br> Tags: Oʻahu <br> Papa helu loli"
Maka-leha,"Stream and mountains, Ka-wai-hau district, Kauaʻi. Stream, Hale-ʻiwa qd., and valley, Schofield qd., Oʻahu. Lit., eyes looking about as in wonder and admiration."
Mākālei,"Place, Diamond Head section, Honolulu, Oʻahu, named either for a fishing temple on the flanks of Diamond Head (TM), or for a fish-attracting branch believed owned by the goddess Haumea, mother of Pele (HM 276-287). See Pāpalahoʻomau.<br> Nā Lepili <br> Tags: Oʻahu <br> Papa helu loli"
Makalena,"Street, ʻĀina-Haina, Honolulu, named for Solomon Maka-lena, a police officer whose family had a homestead here. Lit., muslin (Eng.). An alternate interpretation is Maka-lena (eyes askance)."
Makaliʻi,"Points, Kalaupapa peninsula, Molokaʻi, and Kahana qd., Oʻahu.<br><br>Literally, tiny or Pleiades.<br><br> Nā Lepili <br> Tags: Molokaʻi Oʻahu <br> Papa helu loli"
Maka-nau,"Hill above Hīlea, Kaʻū, Hawaiʻi, and former plantation camp. A heiau on the brow of the hill was named Kohā-i-ka-lani (resound in the sky) for the chief who ordered his men to carry the famous birth pebbles (ʻiliʻili hānau) from Puna-luʻu to be used in<br>construction of the heiau so that it would be unique. After building the heiau the men were ordered to fell an ʻōhiʻa tree for an image; they then killed the chief. He was the grandfather of chiefs mentioned in the ʻUmi story. The heiau was later destroyed when sugar-cane was planted there. Lit., surly eyes."
Mākao,"Land section near Hauʻula, Oʻahu, named for Macao, China. A heiau here, named Luaaliʻi (royal pit), contained a pond within its walls, and around the pond were placed images.<br><br>References:<br><br>Sterling and Summers 4:99-101.<br><br><br><br> Nā Lepili <br> Tags: Oʻahu <br> Papa helu loli"
Makapuʻu,"No base definition, only supplemental content.<br>Pool and land division, Hāna qd., Maui (Ii 172).<br>Avenue, Kaimukī, Honolulu; beach park, point, headland, and surfing beach (Finney, 1959a:108), Koko Head qd., Oʻahu.<br><br>Literally, hill beginning or bulging eye (the name of an image said to have been in a cave known as Keanaokeakuapōloli; PH chapter 19).<br> Nā Lepili <br> Tags: Maui Oʻahu <br> Papa helu loli"
Makaua,"Land section and beach park, Kahana qd., Oʻahu. Literally, unfriendly.<br> Nā Lepili <br> Tags: Oʻahu <br> Papa helu loli"
Maka-ʻula,"Land section, Kai-lua and Ke-āhole qds., Kona, Hawaiʻi. Lit., red eye (so named because of a fire there)."
Makee,"Road, Wai-kīkī, Honolulu, named for James Makee (pronounced McKee), trader, rancher, and captain of whaling ships. He came to Hawaiʻi in 1843 and stayed until his death in 1879. (TM.) He is celebrated in the well-known Hula o Makee about a ship<br>named for him (Elbert and Mahoe 55)."
Mākena,"No base definition, only supplemental content.<br>Land section, Kalapana qd., Hawaiʻi.<br>Village, bay, landing, school, and quadrangle, East Maui.<br><br>Literally, abundance.<br> Nā Lepili <br> Tags: Hawaiʻi Maui <br> Papa helu loli"
Makiki,"Place, street, heights, stream, valley, and section 20 of Honolulu (map 6), probably named for a type of stone used as weights for octopus lures."
Mākila,"Point, land division, reservoir, and ditch, Lahaina qd., Maui. Lit., needle."
Mākini,"Street, Ka-pahulu section, Honolulu."
Mākole,"Land area, northwest Kauaʻi. Land section and point, southeast Lā-naʻi. Lit., red-eyed."
Mākoleʻā,"Point, Keāhole qd., Hawaiʻi. Literally, glowing red eye.<br> Papa helu loli"
Mākua,"Land section, village, cave, stream, valley, surfing beach (Finney, 1959a:108), Kaʻena qd., Oʻahu; the traditional haunt of expert lua fighters. (Ii 98; UL 203.) See Kāneana. Literally, parents.<br> Nā Lepili <br> Tags: Oʻahu lua fighting <br> Papa helu loli"
Makuʻu,"Land sections, Hōnaunau, Kalapana, Makuʻu, and Puna qds.;Quadrangle, Puna district, Hawaiʻi. Probably literally, canoe end-pieces.<br><br>References:<br><br>For. Sel. 256.<br><br><br><br> Papa helu loli"
Māla,"Land division and port, Lahaina qd., Maui. Lit., garden."
Malae,"Heiau near mouth of Wai-lua River, Kauaʻi. See Poli-ʻahu."
Mālaʻe,"Heiau and gulch, Ka-malō qd., south Molokaʻi. Peninsula east of Kāne-ʻohe, Oʻahu. Lit., clear."
Malama,"Inland crater, sea area, land section, and homesteads, Kalapana qd., Hawaiʻi.<br>Name of Kamehameha V's home at Kaunakakai, Molokaʻi (see Kamehameha V).<br>Place, Mānoa, Honolulu, Oʻahu.<br><br><br>Literally, month or moon.<br>References:<br><br>PH 20.<br><br><br><br> Nā Lepili <br> Tags: Hawaiʻi Molokaʻi Oʻahu <br> Papa helu loli"
Mālamalama,"Land section, Kailua, Oʻahu.<br><br>Literally, enlightened.<br><br> Nā Lepili <br> Tags: Oʻahu <br> Papa helu loli"
Malanai,"Street, Pāwaʻa section, and place, Pālama, Honolulu, Oʻahu, named for a gentle breeze.<br> Nā Lepili <br> Tags: winds Oʻahu <br> Papa helu loli"
Malia,"Street, Wai-ʻalae, Honolulu. Lit., Mary. (The street passes Star of the Sea School and is named for Mary, the Mother of Christ, patron saint of the school.)"
Māliko,"Gulch and bay, Pāʻia qd., Maui. Lit., budding."
Malino,"Place, lower ʻĀlewa Heights, Honolulu. Lit., calm."
Maliu,"Point, Ke-āhole qd., Hawaiʻi, once famous for surfing. (For. Sel. 268.) Street, Ka-lihi Uka, Honolulu. Lit., look upon."
Malo,"Land section, Honolua qd., Maui. Lit., loincloth."
Mālua,"Drive, ʻĀlewa Heights, Honolulu. Lit., depression."
Maluhia,"Boy Scout camp, Kahakuloa qd., Maui.<br>Street, Pālolo; State convalescent hospital, Kamehameha Heights, Honolulu, Oʻahu.<br><br><br>Literally, peaceful.<br><br> Nā Lepili <br> Tags: Maui Oʻahu <br> Papa helu loli"
Māmaki,"Bay and point, southeast Lā-naʻi, named for certain native trees, the bark of which was used for tapa; heiau east of Kaunolū, Lā-naʻi, now a rocky enclosure at a cliff edge (Titcomb 19)."
Māmala,"Bay, Honolulu Harbor to Pearl Harbor, Oʻahu, named for a shark woman who lived at the entrance of Honolulu Harbor and often played kōnane. She left her shark husband, ʻOuha, for Honokaʻupu. ʻOuha then became the shark god of Waikīkī and of Koko Head (Finney and Houston 39; Westervelt, 1964b:15, 52-54). In the song “Nā ka Pueo” (Elbert and Mahoe 81), the name of the bay is juxtaposed to mālama, to protect: Ma ka ʻilikai aʻo Māmala, mālama iho ke aloha, on the surface [of the sea] of Māmala, protect the love.<br><br>References:<br><br>See Ke-kai-o-Māmala.<br><br><br><br> Nā Lepili <br> Tags: Oʻahu <br> Papa helu loli"
Mamalu,"Bay near Kau-pō, Maui. Street and place, ʻĀlewa Heights, Honolulu. Lit., shady."
Māmane,"Place, Puna-hou district, Honolulu, named for a native tree."
mana,'supernatural power
Mānā,"Land division, Kaʻū, Hawaiʻi; land divisions and home of the owners of the Parker Ranch, Wai-piʻo qd., Hawaiʻi. Dry western end of Kauaʻi, where an older sister of Pele, Nā-maka-o-Kahaʻi (the eyes of Kahaʻi), introduced the kaunaʻoa dodder. (Ii 150; PH 159; UL 79.) Lit., arid."
Mana,"Heiau, Hālawa qd., Molokaʻi. Place, Wilhelmina Rise, Honolulu. Lit., supernatural power."
Mānai,"Land section, Hāmākua qd., Hawaiʻi. Lit., lei-making needle."
Mānalo,"Gulch, Airport qd., north Molokaʻi. Bishop Museum archaeologists excavated a shelter cave here in 1952. Street, Pā-waʻa section, Honolulu, named for a spring that existed near McKinley High School (TM). Lit., potable."
Manamana,"Site of Queen's Hospital, Honolulu; place and street, Woodlawn, upper Mānoa, Honolulu. Lit., branching."
Mānana,"Offshore island, also known as Rabbit Island, a tuff cone (67 acres, 200 feet elevation), Koko Head qd.; land division, elementary school, and stream at Pearl City, Oʻahu."
Mana-wai,"Land division, Ka-malō qd., Molokaʻi. A heiau here is named for Chief Kumu-koʻa, whose daughter Ka-lola married Ka-mehameha I (RC 109). Lit., water branch."
Mānele,"Harbor and bay, south Lā-naʻi. Street, downtown Honolulu, probably named for the same chiefess as was Ka-mānele Park. Lit., sedan chair."
Māniania,"Cliff, Honu-ʻapo qd., Kaʻū, Hawaiʻi. Ditch, Wai-luku qd., Maui. Waterfall above Moa-ʻula falls, Hālawa qd., Molokaʻi. Lit., a shuddering sensation. (At Kaʻū, Hawaiʻi, a man called Niʻauepoʻo attempted to climb a coconut tree named Niu-loa-hiki. As he climbed, the tree, in its eel form, lifted itself skyward. The man called down to his mother, Ē Hina ē, ē Hina ē, māniania mai nei oʻu mau wāwae, Hina, O Hina, my feet have a shuddering feeling.)"
Mānienie,"Land section and gulch, Hāmākua and Mauna Kea qds., Hawaiʻi. Lit., Bermuda grass."
Manini,"Beach near the south end of Ke-ala-ke-kua Bay, Hawaiʻi, said to be a new name; the old names were Ka-pahu-kapu (the sacred drum) and Wai-ʻamaʻu. Reef, East Maui. Gulch and cliff near Ka-ʻena Point, Oʻahu, named for the manini fish: a man who had been ordered by a chief on pain of death to find an answer to a riddle offered Hiʻiaka a manini fish in return for the answer. Way and street, Ka-lihi Uka and Wilhelmina Rise, Honolulu (the street was probably named for the Matson freighter Manini). Lit., surgeonfish."
Manō,"Ridge in upper Kamana Nui Valley, Moanalua, Oʻahu. A shark man lived in a cave here; both the man and the cave were called Keanaokamanō (the cave of the shark). The man followed bathing parties to the sea and killed them, but he was finally killed. He cultivated kava and yams (uhi). Literally, shark.<br> Nā Lepili <br> Tags: Oʻahu <br> Papa helu loli"
Mānoa,"Stream, Nā-pali coast, Kauaʻi. Land section, stream, waterfall, valley, field, elementary school, and section 28 of Honolulu (map 6). Part of the floor of Mānoa Valley was covered with a lava flow from Sugarloaf cone 10,000 to 20,000 years ago. The Mānoa campus of the University of Hawaiʻi is built on this flow, and Mōʻiliʻili quarry has been excavated in it. (Ii 158; Macdonald and Abbott 376.) Lit., vast."
Manuʻa,"Heiau that once stood on what are now the Queen's Hospital grounds, Honolulu. This name is perhaps cognate with Manu'a in American Samoa. (Appendix 9.)"
Manu-ahi,"Old name for Ka-ʻū-pūlehu, Kona, Hawaiʻi. Stream and valley, south Kauaʻi. Ridge, Ka-malō qd., north Molokaʻi, where the stretching demigod, Kana, lived with his brother Nīheu. Lit., firebird."
Manukā,"Land section, State park, and house, Hoʻō-pū-loa qd., Hawaiʻi, named for a legendary robber. See Kanaka-loloa. Lit., blundering."
Maʻo,"Lane, Kalihi Waena, Honolulu, Oʻahu. See Waiʻaha. Literally, green.<br><br>References:<br><br>TM.<br><br><br><br> Nā Lepili <br> Tags: Oʻahu <br> Papa helu loli"
Māʻoi,"Place, Pālolo, Honolulu. Lit., bold."
Māpunapuna,"Place, road, and spring-fed fishpond formerly at Moanalua, Honolulu. Lit., bubbling."
Mau-hili,See Wai-komo.
Maui,"Second largest island in the Hawaiian group, 48 miles long, 26 miles wide, with an area of 728 square miles and a population in 1970 of 38,691. Wai-luku is the major town and county seat. Maui High School is in Ka-hului. The county includes Maui, Lā-naʻi, Ka-hoʻolawe, and Molokaʻi islands. Epithet: Maui o Kama, Maui of Kama (a famous ancient chief, also called Kama-lālā-walu). The<br>island was named for the demigod Māui (see Appendix 3)."
maukele,"Wet mountain areas, as at Wai-piʻo qd., Hawaiʻi. (See PE, maʻukele.)"
Mau-lua,"Bay and gulch, Honomū qd., Hawaiʻi. Lit., always depressed."
mauna,Mountain'.
Mauna Kea,"Highest mountain in Hawaiʻi (13,796 feet); quadrangle, State park, observatory, and forest reserve; land section, hotel, and golf course, Kohala qd., Hawaiʻi. See Ke-ana-kākoʻi. Lit., white mountain (often the mountain is snowcapped)."
Mauna Keʻa,"Congregational church in Kala-pana. Hawaiʻi. Lit., mount [of the] cross."
Mauna Loa,"No base definition, only supplemental content.<br>Active volcano, second highest mountain in Hawaiʻi, and probably the largest single mountain mass on earth, rising 13,677 feet above sea level and about 29,000 feet above its base on the ocean floor (Macdonald and Abbott 54); also quadrangle and trails, central Hawaiʻi.<br>Shield-shaped dome containing two separate peaks, one of which, Puʻunānā, is the highest point (1,381 feet) in west Molokaʻi; the area was anciently famous for adze quarries, hōlua sliding, and the trees from which kālaipāhoa sorcery images were made (see Kakaʻako).<br><br>Literally, long mountain.<br> Nā Lepili <br> Tags: Hawaiʻi Molokaʻi <br> Papa helu loli"
Maunaloa,"Avenue, Kaimukī, Honolulu, Oʻahu, probably named for an Inter-Island ship.<br>Village, school, and highway, west Molokaʻi.<br><br><br>References:<br><br>See also Mauna Loa.<br><br><br><br> Nā Lepili <br> Tags: Oʻahu Molokaʻi <br> Papa helu loli"
Mauna-una,"Hill (1,769 feet high), Honouliuli, Oʻahu. Lit., mountain sent [on errands]. (Two servant moʻo who lived here had no keepers to supply their needs; Sterling and Summers l:178a.)"
Māwae,"Place, ʻĀlewa Heights, Honolulu. (TM.) Lit., cleft."
Melemele,"Place, Woodlawn, upper Mānoa, Honolulu. (TM.) Lit., yellow."
Menehune,"legendary race of small people who worked at night building fishponds, roads, ditches, and temples<br> Papa helu loli"
Miana,"Points northeast of Hōnaunau Bay, Kona, Hawaiʻi, and at the base of Makapuʻu, Oʻahu. Literally, urinal.<br> Nā Lepili <br> Tags: Hawaiʻi Oʻahu <br> Papa helu loli"
Miko,"Lane, Moana-lua, Honolulu. Lit., salted."
