word,definition
Ka-mole,"Land section, Pāʻia qd.; gulch, Lualaʻi-lua Hills qd., East Maui. Lit., the main root."
Hulēʻia,See Hulā-ʻia.
ʻŌhua,"Avenue, Waikīkī, Honolulu, Oʻahu. Literally, retainer (Liliʻuokalani's retainers lived here).<br> Nā Lepili <br> Tags: Oʻahu <br> Papa helu loli"
Malama,"Inland crater, sea area, land section, and homesteads, Kalapana qd., Hawaiʻi.<br>Name of Kamehameha V's home at Kaunakakai, Molokaʻi (see Kamehameha V).<br>Place, Mānoa, Honolulu, Oʻahu.<br><br><br>Literally, month or moon.<br>References:<br><br>PH 20.<br><br><br><br> Nā Lepili <br> Tags: Hawaiʻi Molokaʻi Oʻahu <br> Papa helu loli"
ʻIo,"Street, Kapālama section, Honolulu, Oʻahu, named for the ʻio hawk, a symbol of royalty because it flies to great heights.<br> Nā Lepili <br> Tags: Oʻahu <br> Papa helu loli"
Kāʻai,"Street, Wailupe, Honolulu, Oʻahu.<br><br>Literally, belt.<br>References:<br><br>TM.<br><br><br><br> Nā Lepili <br> Tags: Oʻahu <br> Papa helu loli"
Koaiʻe,"Cove and former fishing village south of Māhukona, Kohala, Hawaiʻi; excavations in 1968 show that the village was inhabited until historic times. (Newman.) Stream, Wai-mea, Kauaʻi, named for the koaiʻe (Acacia koaia) tree that was uprooted by Nā-maka-o-ka-paoʻo, a Maui hero who made a war club of it."
Haili,"Forest area near Hilo, Hawaiʻi; timber was brought from here to build a church of the same name, said to have been built by Kua-kini (RC 390). Road, Pacific Heights, Honolulu. Lit., loving memory."
Hālupa,"Street, Foster Village, Hālawa, Wai-pahu qd., Oʻahu. Name suggested by Mary Kawena Pukui in 1958. Lit., flourishing (as plants)."
Kalehuawehe,"Name for an ancient surfing area at Waikīkī, Oʻahu (Finney and Houston 38; For. Sel. 35), now called Castle's. Sick persons were brought here for cleansing baths. Literally, the removed lehua lei. (Pīkoi, the rat killer, went to Waikīkī wearing a lehua lei. He asked a surfing chiefess for her board. She refused because the board was taboo. They surfed and he gave her his lei.)<br><br>References:<br><br>Finney and Houston 46, 47; PH 175.<br><br><br><br> Nā Lepili <br> Tags: Oʻahu <br> Papa helu loli"
Pehu,"Street, Pālolo, Honolulu. Lit., swollen."
Kilohana,"Land divisions, Mauna Loa qd., south Hawaiʻi (UL 124); land division (at 9,620 feet), and Girl Scout camp, Wai-kiʻi qd., north Hawaiʻi. Peak and crater, Līhuʻe district, Kauaʻi (Macdonald and Abbott 389, figure 260). A boy, Lahi, and his uncle, while hunting ʻuwaʻu birds on the summit, lured a giant into a hole and killed him; warriors came to catch the bird hunters, but Lahi hid at a pass and threw the men one at a time over a cliff (HM 331, Rice). Lookout, Wai-mea Canyon, Kauaʻi (PH 183). Quadrangle, elementary school, and summit observatory, Hale-a-ka-lā, East Maui, now called White Hill. Summit of the mountain separating ʻUala-puʻe and Wai-lau; point near Ka-laʻe overlooking Ka-laupapa; park and school, ʻUala-puʻe, Molokaʻi. Peak at the head of Ka-lihi Valley, Honolulu. The sorceress Haumea (mother of Pele) lived here with her husband Wākea. While fishing at Heʻeia, she had a premonition of danger to her husband. She returned to Kilohana, left her fishing basket with its crabs and pōhuehue vines (which are still found there), and went down to Wai-ka-halulu (former reef off the Honolulu waterfront); men had tied up Wākea and were carrying him to Wai-kīkī for execu- tion. She begged permission for one last embrace. At her touch the bonds fell away and the two disappeared into a tree (HM 281). In some versions the tree was a breadfruit. Street, Ka-lihi Uka, Honolulu. Lit., lookout point or outer tapa or best, superior."
Kukui,"No base definition, only supplemental content.<br>Village, Hilo qd.; beach, Kohala qd.; point, Honomū qd.; stream, Waipiʻo qd.; ancient surfing areas, Nāpoʻopoʻo and Hōnaunau qds. (Finney and Houston 26), Hawaiʻi.<br>Peak (3,005 feet high) and trail, Waimea Canyon, Kauaʻi.<br>Point, north Lānaʻi.<br>Peak (5,788 feet high), Lahaina qd., and bay, Kīpahulu qd., Maui.<br>Heiau, Kamalō qd., south Molokaʻi; and elevation, Mauna Loa, Airport qd., Molokaʻi, where the men of Pālāʻau to the north were turned into kauila trees. In this story ʻUmi-a-Maka, a youth skilled in mokomoko (hand-to-hand fighting) who lived above ʻĪloli hill at Kawailoa, was challenged by an unknown from Kawahuna. On the advice of his kahuna, ʻUmi-a-Maka brought a small black pig to Kukui Hill. Its squealing drove away his opponents' gods and turned the people into kauila trees (Ka Nupepa Kuokoa, September 14, 1922).<br>Area on the Makapuʻu side of Pāhonu, Waimānalo, Oʻahu (For. Sel. 266).<br>Downtown Honolulu, Oʻahu lane and street named in 1856; the first street lamp (kukui) was at Fort and Kukui streets (TM).<br><br>The State tree is the kukui; its oily nuts were used for lights. Literally, candlenut lamp, light of any kind.<br> Nā Lepili <br> Tags: Hawaiʻi Kauaʻi Lānaʻi Maui Molokaʻi Oʻahu <br> Papa helu loli"
kukui,‘candlenut’<br> Nā Lepili <br> Tags: flora trees <br> Papa helu loli
Hanapēpē,"Land section, town, bay, ditch, falls, stream, valley, and ancient surfing place (Finney and Houston 30), southern Wai-mea district, Kauaʻi. (For. Sel. 102.) Lit., crushed bay (due to land-slides)."
Welokā,"Heiau, Waialua, Molokaʻi, where Kamehamehanui of Maui was reared (Summers 149).<br><br>Literally, hit float.<br>References:<br><br>See Pākaikai.<br><br><br><br> Nā Lepili <br> Tags: Molokaʻi <br> Papa helu loli"
Hoʻolana,"Ancient surfing area, Kohala district, Hawaiʻi. (Finney, 1959a:51.) Lit., to cause to float."
Hīlia,"Offshore area extending from Pākanaka Pond through Kalamaʻula, south central Molokaʻi. Literally, smitten. (Mullet were so numerous that fishermen kicked them ashore with the sides of their feet [kā wāwae].)<br> Nā Lepili <br> Tags: geography Molokaʻi <br> Papa helu loli"
ʻEleao,"Land section, Wai-kāne qd., Oʻahu. Lit., plant louse."
Brown,"Beach park, Kalapana qd., Puna, Hawaiʻi, named in 1953 for Harry Kaina Brown, Hawaiʻi county auditor.<br>Way, Mānoa, Honolulu, Oʻahu, named for Mrs. Marie D. Brown, principal of Mānoa School 1898-1928 (History of Mānoa School); she was a descendant of the Beckley and Montano families (TM).<br>Golf course, named for Francis li Brown, ʻAiea, Waipahu qd., Oʻahu.<br><br> Nā Lepili <br> Tags: Hawaiʻi Oʻahu golf <br> Papa helu loli"
Miana,"Points northeast of Hōnaunau Bay, Kona, Hawaiʻi, and at the base of Makapuʻu, Oʻahu. Literally, urinal.<br> Nā Lepili <br> Tags: Hawaiʻi Oʻahu <br> Papa helu loli"
Pāʻia,"Quadrangle, village, bay, and school, East Maui. Lit., noisy."
Frog,"Lane, Nuʻu-anu, Honolulu, named for the many frogs in the taro patches there. (TM.)"
Pau-ahi,"Land section and gulch, Wai-piʻo qd.; land section, Kai-lua qd.; pit crater, Puna qd., Hawaiʻi. Street, downtown Honolulu, named in memory of the great fire of 1886 and of the aunt of Bernice Pau-ahi Bishop (and mother of Princess Ruth) who had been named Pau-ahi because as a child she was saved from a fire. Building, Puna-hou campus, Honolulu, donated by Charles Bishop in memory of his wife, and built in 1894. The administration building at the Ka-mehameha Schools, built in 1964, was named for Princess Bernice Pau-ahi, the benefactress of the schools. The Bishop Museum entomology building, built in 1964, is named Pau-ahi Hall. Lit., destroyed [by] fire."
Pū-ʻula,"Congregational church and village near Koaʻe, Puna, Hawaiʻi. In the early days, church service was announced by a red conch shell (pū ʻula). When a bell was obtained, the conch was buried and a funeral was held for it; later it was stolen. Pele's first landing in Puna was at Ke-awa-o-Pele near here; from there she went to Ke-ahi-a-Laka and Poho-iki, where she dug craters. See Koaʻe."
ʻĀkala,"Street, Sheridan Tract, Honolulu, Oʻahu. Literally, raspberry.<br> Nā Lepili <br> Tags: Oʻahu <br> Papa helu loli"
Māilo,"Peak, Waimānalo, Oʻahu, said to be named for a strong chief.<br><br>Literally, thin.<br>References:<br><br>Sterling and Summers 5:338<br><br><br><br> Nā Lepili <br> Tags: Oʻahu aliʻi <br> Papa helu loli"
Lukela,"Lane, Ka-lihi Waena, Honolulu, named for Joe Lukela, a fisherman. (TM.) Lit.,Luther."
Melemele,"Place, Woodlawn, upper Mānoa, Honolulu. (TM.) Lit., yellow."
Pāpā,"No base definition, only supplemental content.<br>Village, bay, and land sections, Hoʻōpūloa qd., Hawaiʻi.<br>Heiau, Hālawa qd., north Molokaʻi (Summers 169).<br><br>Literally, forbidden.<br> Nā Lepili <br> Tags: Hawaiʻi Molokaʻi <br> Papa helu loli"
Wai-ʻaleʻale,"Land section, Wai-piʻo qd., Hawaiʻi. Highest mountain on Kauaʻi (5,080 feet), with a mean annual rainfall of 476 inches. (PH 109; UL 40.) Lit., rippling water or overflowing water."
Kaihuokapuaʻa,"Land sections at Koko Head and at Waimano, Oʻahu; also a stone at Waimano. Literally, the snout of the pig (Kamapuaʻa).<br> Nā Lepili <br> Tags: Oʻahu <br> Papa helu loli"
Puʻu-one,"Land section, Wai-luku qd., Maui. Lit., sand hill."
Pākīpika,Pacific.
Hāliʻi,"Stream and falls, Līhuʻe district, Kauaʻi.<br><br>Literally, strewn.<br><br> Nā Lepili <br> Tags: Kauaʻi <br> Papa helu loli"
Poli-ʻahu,"Well-preserved heiau in a State park near Wai-lua, Kauaʻi, associated with Malae heiau. Land division on Mauna Kea, Hawaiʻi (UL 251), named for the snow goddess. Lit., garment [for the] bosom (referring to snow)."
Hanamāʻulu,"Landing, land section, village, bay, ditch, river, beach park, and birthplace of the hero Ka-welo, Līhuʻe district, Kauaʻi. (For. Sel. 32, 102.) Street, Hawaiʻi-kai, Honolulu. Lit., tired (as from walking) bay."
Hālau-lani,"Land division near the Pineapple Research Institute, Wai-piʻo, Wai-pahu qd., Oʻahu; ʻAhu-ʻena heiau was formerly here (Sterling and Summers 1:94–95). Lit., high-born chiefs large house."
Mākila,"Point, land division, reservoir, and ditch, Lahaina qd., Maui. Lit., needle."
ʻŌlino,"Street, Foster Village subdivision, Hālawa, Wai-pahu qd., Oʻahu. Name suggested by Mary Kawena Pukui in 1956. Lit., brilliant, shiny."
Kāmala,"Point, Kō-loa district, Kauaʻi. Lit., hut."
Nānaina,"Place, ʻĀlewa Heights, Honolulu, Oʻahu.<br><br>Literally, view.<br><br> Nā Lepili <br> Tags: Oʻahu <br> Papa helu loli"
Kikilia,"Place, Pālolo, Honolulu. Lit., Cecelia."
Pā-lāʻau,"Three land divisions, Airport and Kaunakakai qds., north central and southwest Molokaʻi; State park overlooking Ka-laupapa peninsula and containing the phallic stone Ka-ule-o-Nānāhoa. See Puʻu-lua. Lit., wooden fence or enclosure."
Māliko,"Gulch and bay, Pāʻia qd., Maui. Lit., budding."
Wailua,"Land division and stream, Honomū qd.; land division, Honuʻapo qd., Hawaiʻi.<br>State park, land division, river, falls, valley, town, and golf course, Līhuʻe qd., Kauaʻi.<br>Heiau, a place of refuge, and birth stones here are said to be in excellent condition. (UL 255.) See Kaʻōhala.<br>Bay, Kīpahulu qd., Maui.<br><br><br>Literally, two waters.<br><br> Nā Lepili <br> Tags: Hawaiʻi Kauaʻi Maui <br> Papa helu loli"
ʻOlu,"Street, Ka-imu-kī, Honolulu. (TM.) Lit., cool."
Kākela,"Drive and place, lower Mānoa, Honolulu, named for George P. Castle (1851–1932), a son of Samuel Northrup Castle, who lived there. He was president of Castle and Cooke 1903–1916. Lit., castle. (TM.)"
Pua-puaʻa,"Land section, Kai-lua qd., North Kona, Hawaiʻi. See Ka-helo. Lit., piglet (named for supposed resemblance of two large rocks to pigs)."
Kīkēkē,"Avenue, Ka-imu-kī, Honolulu. (TM.) Lit., to knock."
Mōkapu,"A bird islet (3.6 acres, 360 feet elevation), Kamalō qd., north Molokaʻi.<br>Peninsula, elementary school, point, quadrangle, and land division, Kailua, Oʻahu; originally named Mokukapu (sacred district) because Kamehameha I met his chiefs here; it was “the sacred land of Kamehameha” (Sterling and Summers 5:165).<br><br><br>Literally, taboo district (mō- is short for moku).<br>References:<br><br>See North Beach.<br><br><br><br> Nā Lepili <br> Tags: geography Molokaʻi Oʻahu <br> Papa helu loli"
ʻAkaka,"Falls (422 feet high) and State park near Hilo, Hawaiʻi. When a stone here called Pōhaku-a-Pele (stone of Pele) is struck by a lehuaʻapane branch, the sky darkens and rain falls. A large stone in mid-stream about 70 feet above the falls is named Pōhaku-o-Kāloa.<br> Nā Lepili <br> Tags: Hawaiʻi image <br> Papa helu loli"
ʻAkāka,"Projecting spur of the mountain range at the head of Mānoa Valley; a street near the Chinese cemetery, Mānoa, Honolulu, Oʻahu, named for the mountain that is said to be the grandparent of the Mānoa princess, Ka-hala-o-Puna (HM 152).<br><br>Literally, clearness.<br><br> Nā Lepili <br> Tags: Oʻahu <br> Papa helu loli"
Haʻehaʻe,"Land division near Kumu-kahi, Makuʻu qd., Hawaiʻi. Ka hikina a ka lā i Haʻehaʻe (PH 189), the rising of the sun at<br>Haʻehaʻe. See Kumu-kahi."
Ka-lama,"Coastal section, south central Ka-hoʻolawe. Stream, Ka-wai-hau district, Kauaʻi. Beach park, Puʻu-o-kali qd., Maui, named for Samuel E. Kalama, Maui County Chairman 1913–1933. Valley, young lava flow, and cinder cone (about 35 feet high with a crater 50 feet deep in its summit), Koko Head qd., Oʻahu (Macdonald and Abbott 378); beach club and street, Mō-kapu qd., Oʻahu. Street, Ka-lihi Waena, Honolulu; Ka-mehameha Schools dining hall, Honolulu, built in 1954, and named for the wife of Ka-mehameha III."
Ka-lama-,"Five land sections near Ke-ala-ke-kua Bay, Kona, Hawaiʻi, probably named for a family. The names are Kalama-kumu (source Kalama), Kalama-ʻUmi, Kalama-kowali (swinging Kalama), Kala-ma-kāpala (staining Kalama), Kalama-wai-ʻawaʻawa (bitter water Kalama). (For. 4:588–589.)"
Ka-hiʻu,"Point, Ka-laupapa peninsula, Molokaʻi. Lit., the fish tail. Also called Lae-o-Kahiʻu."
Wai-koʻo-lihilihi,"Pool at Puna, Hawaiʻi. Lit., water supporting eye-lashes. (Lehua flowers were fastened on reeds here in honor of visiting chiefs; when they kneeled to drink, the blossoms touched their eyelashes. The last royal person to visit here was Ke-oho-kālole, mother of Ka-lā-kaua and Liliʻu-o-ka-lani.)"
ʻAʻawa,"Ancient surfing area near Waiehu, West Maui.<br><br>Literally, wrasse fishes.<br>References:<br><br>Finney and Houston 28.<br><br><br><br> Nā Lepili <br> Tags: Maui fish <br> Papa helu loli"
Kaulu,"Land section, Honomū qd., northeast Hawaiʻi; pali, Honu-ʻapo qd., south Hawaiʻi; ancient surfing area, Ke-au-hou, Kai-lua qd., North Kona, Hawaiʻi. (Finney and Houston 26.) Lit., ledge."
Ka-ʻulu,"Land section near Hōʻaeʻae, Oʻahu, named for chief Ka-ʻulu-hua-i-ka-hāpapa (the breadfruit bearing fruit on the flats) from Puna, Hawaiʻi."
Nānākuli,"Land section, town, school, forest reserve, stream, valley, beach park, and surfing area, Waiʻanae qd., Oʻahu. (li 29.)<br><br>Literally, look at knee (said to be named in honor of the tattooed knee of Kaʻōpulupulu, a priest whose chief, Kahahana, turned a deaf [kuli] ear to his advice, and, when asked about his knee, told of his relationship with the chief, thus rebuking him); or look deaf (said because people in the area had not enough food to offer passersby; hence they looked at them and pretended to be deaf).<br><br> Nā Lepili <br> Tags: Oʻahu <br> Papa helu loli"
Manuʻa-kepa,"Land section, Hanalei, Kauaʻi. (See PE, limu-kā-kanaka; PH 5; UL 133.)"
Pūlama,"Land section, Puna qd., Hawaiʻi.<br><br>Literally, to cherish.<br><br> Nā Lepili <br> Tags: Hawaiʻi <br> Papa helu loli"
Hāloku,"Falls, Kamalō qd., north Molokaʻi. Literally, to ripple.<br> Nā Lepili <br> Tags: Molokaʻi <br> Papa helu loli"
Ka-ʻena,"Point and land section, Puna qd., Hawaiʻi. Northwesternmost point, Lā-naʻi (see North End). ʻAiʻai, the fish demigod, marked a stone here that then turned into the first Hawaiian turtle. (HM 22.) See Poli-hua. Land division, quadrangle, and northwesternmost point, Oʻahu, said to be named for a brother or cousin of Pele who accompanied her from Kahiki. (PH 100, 106, 157.) See Kua-o-ka-lā. Lit., the heat."
Kahikolu,"Congregational church at Nā-poʻopoʻo, Kona, Hawaiʻi. Lit., trinity."
School,"Midtown street, Honolulu, Oʻahu, first named School Lane in 1850. It led to the Royal School.<br><br>References:<br><br>Clark 10-11.<br><br><br><br> Nā Lepili <br> Tags: Oʻahu <br> Papa helu loli"
Wai-hī,"One of several streams originating in the high Koʻolau mountains behind Mānoa Valley, and debouching near or at Mānoa Falls, Honolulu. Lit., trickling water."
ʻAila,"Street, Moana-lua, Honolulu, Lit., oil."
Puʻu-lena,"Pit crater, Kala-pana qd., Hawaiʻi. (Macdonald and Abbott 314.) A wind coming from here has the same name. Ancient surfing area, Hanalei district (?), Kauaʻi (Finney, 1959b:347). Hill at the upper end of the Chinese cemetery, Mānoa, Honolulu. (PH 193.) Lit., yellow hill."
Māmane,"Place, Puna-hou district, Honolulu, named for a native tree."
Nā-pili,"Bay and land section, Lahaina qd., Maui. Lit., the joinings or pili grass. (RC 74.)"
Castle,"Hospital, Kai-lua, Oʻahu, named for Harold K.L. Castle who donated the land. High school, Kāne-ʻohe, Oʻahu, and street, Ka-pahulu, Honolulu, named for financier James Bickness Castle (1857-1918), father of Harold K.L. Castle and son of the lay missionary Samuel N. Castle (1808-1894), a founder of the mercantile firm Castle and Cooke. (TM.) Trail, Hau-ʻula Forest Reserve, beginning at Puna-luʻu and following the ridge on the Kāne-ʻohe side of Ka-lua-nui Stream, Kahana qd., Oʻahu. See Kakela, Puʻuhonua."
Kūpikipikiʻō,"Old name for Black Point, Oʻahu. Lit., rough [sea]."
Lighthouse,"Surfing area, Diamond Head, Honolulu, named for the Diamond Head Lighthouse. (Finney, 1959a:108.)"
Keawe,"Street, Kakaʻako, Honolulu, Oʻahu, named for a chief.<br> Nā Lepili <br> Tags: Oʻahu <br> Papa helu loli"
Kahe,"Land section, point, beach park, and power plant, Wai-ʻanae qd., Oʻahu. See ʻEwa. Lit., flow."
Kāwala,"Land section, Kaʻū, Hawaiʻi, extending from Kāhili-pali. Literally, strike backwards.<br> Nā Lepili <br> Tags: Hawaiʻi <br> Papa helu loli"
Hane-oʻo,"Land section, gulch, and large fishpond reportedly built in 1808 near Hāna, Maui. A female moʻo was sometimes seen here. Lit., mature soul."
Kapaʻa,"No base definition, only supplemental content.<br>Land section and beach park, Kohala qd., Hawaiʻi.<br>Land section, town, ditch, elementary school, weir, and beach park, Kawaihau district, Kauaʻi.<br>Land division, Kailua, Oʻahu, and a quarry there worked in the 1950s. (The area with the quarry may have been so named because of the solid rock there.) Ka laulā mauka o Kapaʻa ē, mai paʻa i ka leo (UL 40), the upland expanse of the closure, do not close your voice (an appeal for hospitality).<br><br>Literally, the solid or the closing.<br> Nā Lepili <br> Tags: Hawaiʻi Kauaʻi Oʻahu <br> Papa helu loli"
Halāliʻi,"Cinder cone, Hale-a-ka-lā Crater, East Maui. Land section and lake, south central Niʻihau, named for its owner and famous for sugarcane growing in the sand with only leaves protruding. (See PE, kō; UL 101.) Hālāliʻi is the name of an Oʻahu trickster demigod (HM 430)"
Mission,"Lane leading to the old mission houses behind Kawaia-Haʻo Church, Honolulu, Oʻahu, named in 1850.<br><br>References:<br><br>TM.<br><br><br><br> Nā Lepili <br> Tags: Oʻahu <br> Papa helu loli"
ʻOwena,"Street, Diamond Head, Honolulu, believed named for Owen Jones Holt, father of the mounted police officer Edward S. Holt, whose home was at Diamond Head. (TM.) Lit., Owen."
Laʻelaʻe,"Way, Ka-lihi Uka, Honolulu. (TM.) Lit., bright."
Pai-a-haʻa,"Land division and ancient surfing area east of South Point, Kaʻū, Hawaiʻi. (UL 191.) Lit., lift and sway [of waves]."
Laʻa-kea,"Street and place, Foster Village subdivision, Hālawa, Wai-pahu qd., Oʻahu. Name suggested by Mary Kawena Pukui in 1956. Lit., sacred light, as of sunshine, happiness, or knowledge."
ʻAlae,"No base definition, only supplemental content.<br>Land section, Honomū qd.; pit crater near Kīlauea Crater, Puna qd., Hawaiʻi, active in 1969 (Macdonald and Abbott 101).<br>Land sections and homesteads, Puʻuokali qd., Kula, Maui.<br>Peak (2,000 feet high), above Kalaupapa peninsula, Molokaʻi.<br><br>Literally, mudhen.<br> Nā Lepili <br> Tags: Hawaiʻi Maui Molokaʻi <br> Papa helu loli"
ʻAlaʻē,"School and land sections, Kealakekua, Hawaiʻi. Literally, strange fragrance.<br> Nā Lepili <br> Tags: Hawaiʻi <br> Papa helu loli"
puʻu,"Hill, mountain, cone, peak, elevation'. Some names are written either with or without puʻu (as Puʻu-kukui and Kukui). In a few names puʻu is shortened to pū- (as Pū-ʻalaea, Pū-koʻo, Pū-o-waina)."
Puʻu,"Ancient surfing area, Keolonāhihi, Kailua qd., Hawaiʻi.<br><br>Literally, peak.<br>References:<br><br>Finney and Houston 26.<br><br><br><br> Nā Lepili <br> Tags: Hawaiʻi <br> Papa helu loli"
Kū-paʻa,"Gulch, Wai-luku qd., West Maui. Drive, Pālolo, Honolulu (TM). Lit., steadfast."
Malae,"Heiau near mouth of Wai-lua River, Kauaʻi. See Poli-ʻahu."
Mālaʻe,"Heiau and gulch, Ka-malō qd., south Molokaʻi. Peninsula east of Kāne-ʻohe, Oʻahu. Lit., clear."
Pālua,"Place, Wilhelmina Rise, Honolulu, Oʻahu.<br><br>Literally, second.<br><br> Nā Lepili <br> Tags: Oʻahu <br> Papa helu loli"
ʻĪlio,"Point and quadrangle, West Molokaʻi. See Kalaeokaʻīlio. Literally, dog.<br> Nā Lepili <br> Tags: Molokaʻi <br> Papa helu loli"
Pākākā,"Old canoe landing, Honolulu Harbor (Honolulu in 1810). Wharf built in 1827 at the same site. See Robinson. Lit., to skim (as stones over water)."
Kahala,"Point, Kōloa district, Kauaʻi. A heiau here was called Kūhāhāpō (Kū feeling [at] night).<br>* Pronunciation and meaning are uncertain.<br> Nā Lepili <br> Tags: Kauaʻi <br> Papa helu loli"
Kāhala,"Avenue, elementary school, field, and section 37 of Honolulu (map 6), Oʻahu.<br><br>Literally, amberjack fish.<br><br> Nā Lepili <br> Tags: Oʻahu <br> Papa helu loli"
Nāpuʻu,"Inhabited and gardened area between Puʻuanahulu and Puʻuwaʻawaʻa, Kona, Hawaiʻi. Chief Keawenui-a-ʻUmi appointed Ehu as supervisor, and Kona became known as Kona, kai malino a Ehu (Kona, calm seas of Ehu). Bananas, sugarcane, sweet potatoes, and yams were plentiful until the supernatural dog, Puapualenalena, began to steal.Literally, the hills.<br> Nā Lepili <br> Tags: Hawaiʻi <br> Papa helu loli"
ʻŌhiʻa,"No base definition, only supplemental content.<br>Gulch, Haʻikū qd., Maui. Two holes in the gulch sides are said to have been made by the god Kāne who thrust in his spear to get water for himself and for Kanaloa (HM 65).<br>Two land divisions and a gulch, Kamalō qd., southeast Molokaʻi. Ancient surfing area, west Niʻihau (Finney and Houston 30).<br><br>Literally, ʻōhiʻa tree.<br> Nā Lepili <br> Tags: Maui Molokaʻi <br> Papa helu loli"
Kēwā,"Land section near Wai-lua, Kauaʻi. (UL 136.) Stream, Kāne-ʻohe, Oʻahu. Lit., anticipation."
Booth,"Road and park, Pauoa, Honolulu, dedicated in 1950 and named for Charles W. Booth (1866-1910) who gave part of the land to the park. (Honolulu Advertiser, October 17, 1947.)"
Ka-ʻai-pū,"Avenue, Mānoa, Honolulu, named for a stone under which lived a supernatural woman. Three land parcels of this name were awarded in the early 1850s. (Indices 318, 319.) Lit., the eating together."
Pū-ʻālaʻa,"Land section, Kala-pana qd., Puna, Hawaiʻi, said to be named for the ʻālaʻa tree, common here but rare elsewhere. An ancient and hitherto unrecorded village site was discovered here by Bishop Museum archaeologists in 1971. Lit., Planchonella tree."
PE,"Pukui and Elbert, Hawaiian Dictionary"
Hau,"Street, Ka-lihi Kai, Honolulu. (TM.) Lit., Hibiscus tiliaceus."
Wailau,"Land section, Honuʻapo and Pāhala qds., Hawaiʻi.<br>Valley, Waimea district, Kauaʻi.<br>Valley, land division, trail, former village, and stream, Kamalō qd., north Molokaʻi. In Ka Nupepa Kuokoa of August 2, 1912, are listed many place names along the trail from Pūkoʻo, Molokaʻi, up over the mountain and down to the bottom of Wailau Valley.<br><br><br>Literally, many waters.<br><br> Nā Lepili <br> Tags: Hawaiʻi Kauaʻi Molokaʻi <br> Papa helu loli"
Kāheawai,"Old name for a place in south Kaʻū, Hawaiʻi. Literally, water calling (a chief here shouted loudly when he wanted water).<br> Nā Lepili <br> Tags: Hawaiʻi Kaʻū <br> Papa helu loli"
ʻŌʻio,"Drive and old land section, ʻĀina-Haina, Honolulu, Oʻahu.<br>Stream, Kahana and Lāʻie qds., Oʻahu.<br><br><br>Literally, bonefish.<br>References:<br><br>See Kalaeokaʻōʻio.<br><br><br><br> Nā Lepili <br> Tags: Oʻahu <br> Papa helu loli"
Kekele,"Land division at the foot of Nuʻu-anu Pali, Oʻahu, famous for the fragrance of hala flowers and fruits. Lit., damp."
Pā-waʻa,"Section 24 of Honolulu (map 6); the Cinerama Theater here was formerly called Pā-waʻa. Lit., canoe enclosure. (It is said that canoes were brought here from the sea by canal. But also see Kaha-loa.)"
Manuʻa,"Heiau that once stood on what are now the Queen's Hospital grounds, Honolulu. This name is perhaps cognate with Manu'a in American Samoa. (Appendix 9.)"
Ka-puaʻi,"Ancient surfing area, bay or district, Hāna, Maui. (Finney 1959a:52.) Lit., the flow [of water]."
Pā-kanaka,"Fishpond, Airport qd., south Molokaʻi. (Summers 71-75.) Lit., touched [by] commoners (it could be used by commoners)."
Kuolo,"Area near Keaʻau, Puna, Hawaiʻi, where the Puna chief, Huaʻā, was defeated, thus giving control of Puna to ʻUmi (For. Sel. 168). Lit., to rub."
Hiʻolani,"Place, Pauoa, Honolulu. Lit., slumber."
